{"$schema":"https://json-schema.org/draft/2020-12/schema","$id":"https://fs-gg.github.io/schemas/evidence/external-observations/v1","category":"external-observations","type":"object","required":["schema","id","source","observedAt","sha256"],"properties":{"schema":{"const":"fsgg.coordination.external-observation/1"},"id":{"type":"string","minLength":1},"source":{"type":"string","minLength":1},"observedAt":{"type":"string","format":"date-time"},"sha256":{"type":"string","pattern":"^[0-9a-f]{64}$"}},"additionalProperties":false}
