{"schema":"fsgg.coordination.external-observation/1","id":"GS2-03.10-authority-policy","source":"github-blob:FS-GG/FS.GG.Coordination.Authority@63cd206a8ed0a57ecbe554499ea88d7ed0287da3/evidence/2026-08-30-authority-policy-qualification.json","observedAt":"2026-08-30T19:13:04Z","sha256":"632ac9272a42ac16355aeb820f07b529092c24365bec7adb9e4c74f0979f375d"}
